{
  "id": "R4-S28",
  "verdict": "open",
  "verdict_reason": "CLMS SWF (open, EU-wide, attribution-only) and Sentinel-2 SR (open, GEE catalog) fetched and verified, no application needed. Crux: only 3 sparse epochs (2015/2018/2021) exist, not annual; no register of newly-planted-hedgerow locations found, so 'new planting' ground truth must be constructed via SWF epoch-differencing plus manual orthophoto spot-checks.",
  "sources": [
    {
      "name": "CLMS High Resolution Layer Small Woody Features",
      "role": "labels",
      "url": "https://land.copernicus.eu/en/products/high-resolution-layer-small-woody-features",
      "fetched_ok": true,
      "licence_quote": "no limitations to public access",
      "licence_class": "open",
      "access_mode": "direct_download",
      "platform_id": "n/a",
      "size_gb": null,
      "coverage_quote": "the entire EEA38 + UK region",
      "covers_target_region": "true",
      "date_range": "Epochs 2015, 2018, 2021 (3-yearly); 2018 epoch imagery window 2017-01-01 to 2019-12-31",
      "caveats_quoted": [
        "Small Woody Features 2021 (vector/raster 5 m and 100 m), Europe, 3-yearly",
        "UK 2021 data to be added Q2 2026"
      ],
      "nicfi_purpose_check": null,
      "sg_farmland_terms_ok": null,
      "application_deadline": null
    },
    {
      "name": "Sentinel-2 MSI Surface Reflectance Harmonized (GEE)",
      "role": "imagery",
      "url": "https://developers.google.com/earth-engine/datasets/catalog/COPERNICUS_S2_SR_HARMONIZED",
      "fetched_ok": true,
      "licence_quote": "The use of Sentinel data is governed by the Copernicus Sentinel Data Terms and Conditions.",
      "licence_class": "open",
      "access_mode": "gee_catalog",
      "platform_id": "COPERNICUS/S2_SR_HARMONIZED",
      "size_gb": null,
      "coverage_quote": "Global, 2017-03-28 to 2026-09-12 (ongoing), 5-day revisit",
      "covers_target_region": "true",
      "date_range": "2017-03-28 to present",
      "caveats_quoted": [
        "2017-2018 Level-2 coverage in Earth Engine is not yet complete worldwide"
      ],
      "nicfi_purpose_check": null,
      "sg_farmland_terms_ok": null,
      "application_deadline": null
    },
    {
      "name": "France RPG (Registre Parcellaire Graphique) hedgerow layer - candidate new-planting register",
      "role": "auxiliary",
      "url": "https://www.data.gouv.fr/fr/datasets/registre-parcellaire-graphique-rpg-anonyme/",
      "fetched_ok": false,
      "licence_quote": "",
      "licence_class": "unknown",
      "access_mode": "unverified",
      "platform_id": "n/a",
      "size_gb": null,
      "coverage_quote": "",
      "covers_target_region": "partial",
      "date_range": "unknown - page not fetchable",
      "caveats_quoted": [
        "404 Not Found - dataset URL could not be resolved within search/fetch budget"
      ],
      "nicfi_purpose_check": null,
      "sg_farmland_terms_ok": null,
      "application_deadline": null
    }
  ],
  "ground_truth": {
    "status": "must_construct",
    "source_url": null,
    "construction_protocol": "Flag candidate new-hedgerow pixels as SWF gap-to-present transitions across 2015/2018/2021 epochs; a researcher manually spot-checks a sample against national VHR aerial orthophoto archives, since no EU-wide or national register of newly-planted-hedgerow locations was located.",
    "label_count_estimate": null
  },
  "compute_path": {
    "platform": "Google Earth Engine (Sentinel-2 SR Harmonized time series) plus direct-download CLMS SWF vector/raster tiles for epoch differencing",
    "fits_C9": true,
    "why": "Epoch differencing and S2 compositing run as raster algebra/classical ML in GEE or locally; no sustained GPU training or multi-day jobs needed.",
    "gpu_hours_per_week_estimate": 0
  },
  "queries": [
    {
      "q": "Copernicus Land Monitoring Service Small Woody Features landing page licence",
      "useful": true
    },
    {
      "q": "CLMS Small Woody Features 2018 2021 epochs reference years",
      "useful": true,
      "note": "confirmed only 3 epochs: 2015, 2018, 2021"
    },
    {
      "q": "land.copernicus.eu data policy licence free, full and open",
      "useful": false,
      "note": "session WebSearch quota exhausted mid-run"
    },
    {
      "q": "EU register newly planted hedgerows location GIS Nature Restoration Law monitoring",
      "useful": false,
      "note": "session WebSearch quota exhausted mid-run"
    },
    {
      "q": "duckduckgo: EU register newly planted hedgerows location geolocated France Plan Haies Pacte haie",
      "useful": false,
      "note": "blocked by CAPTCHA page"
    },
    {
      "q": "bing: plan haies OR haagplantsubsidie geolocated register newly planted hedgerows shapefile",
      "useful": false,
      "note": "irrelevant results returned"
    },
    {
      "q": "data.gouv.fr site search: haies plantees",
      "useful": false,
      "note": "client-rendered search page, no results extractable"
    }
  ],
  "fetched": [
    "https://land.copernicus.eu/en/products/high-resolution-layer-small-woody-features",
    "https://land.copernicus.eu/en/products/high-resolution-layer-small-woody-features/small-woody-features-2021",
    "https://land.copernicus.eu/en/products/high-resolution-layer-small-landscape-features",
    "https://www.eea.europa.eu/en/datahub/datahubitem-view/a3bb6014-54a8-4bd4-871e-e6718e8f2726",
    "https://sdi.eea.europa.eu/catalogue/srv/api/records/a8e683b1-2f96-45c8-827f-580a79413018?language=eng",
    "https://land.copernicus.eu/en/data-policy",
    "https://html.duckduckgo.com/html/?q=EU+register+newly+planted+hedgerows+location+geolocated+France+Plan+Haies+Pacte+haie",
    "https://www.bing.com/search?q=%22plan+haies%22+OR+%22haagplantsubsidie%22+geolocated+register+newly+planted+hedgerows+shapefile",
    "https://developers.google.com/earth-engine/datasets/catalog/COPERNICUS_S2_SR_HARMONIZED",
    "https://www.data.gouv.fr/fr/datasets/?q=haies+plantees",
    "https://fr.wikipedia.org/wiki/Haie",
    "https://www.data.gouv.fr/fr/datasets/registre-parcellaire-graphique-rpg-anonyme/"
  ],
  "budget_exhausted": true,
  "notes": "Fetch budget (12) fully used. WebSearch quota exhausted session-wide after 4 calls; DuckDuckGo/Bing/data.gouv.fr fetched as search substitutes but were low-signal (CAPTCHA/SPA/irrelevant). No EU or national register recording WHERE hedgerows were newly planted could be located and fetched; treat as a real gap, not just a search miss."
}
